<?xml version="1.0" encoding="UTF-8"?>
<p:historical_element_parser_v1
	xmlns:p="historical_element_parser_v1"
	xmlns:xsi="http://www.w3.org/2001/XMLSchema-instance"
	xsi:schemaLocation="historical_element_parser_v1 ../../../../../adapter-lib/src/main/resources/schemas/manager/historical_element_parser_v1.xsd"
	element_type_id="3">
	<p:target_table>hist.det_revenga</p:target_table>
	<p:table_space>tbl_hist</p:table_space>
	<p:field_element_id>f_element_id</p:field_element_id>
	<p:fields>
		<p:field name="date" pk="true" indexed="true">
			<p:element_type_param>
				<p:element_type_param_id>1</p:element_type_param_id>
				<p:param_type_id>2</p:param_type_id>
			</p:element_type_param>
		</p:field>
		<p:field name="n_vehicles">
			<p:element_type_param>
				<p:element_type_param_id>4</p:element_type_param_id>
				<p:param_type_id>2</p:param_type_id>
			</p:element_type_param>
		</p:field>
		<p:field name="occupancy">
			<p:element_type_param>
				<p:element_type_param_id>6</p:element_type_param_id>
				<p:param_type_id>2</p:param_type_id>
			</p:element_type_param>
		</p:field>
		<p:field name="congestion">
			<p:element_type_param>
				<p:element_type_param_id>7</p:element_type_param_id>
				<p:param_type_id>2</p:param_type_id>
			</p:element_type_param>
		</p:field>
		<p:field name="speed">
			<p:element_type_param>
				<p:element_type_param_id>9</p:element_type_param_id>
				<p:param_type_id>2</p:param_type_id>
			</p:element_type_param>
		</p:field>
		<p:field name="gap">
			<p:element_type_param>
				<p:element_type_param_id>10</p:element_type_param_id>
				<p:param_type_id>2</p:param_type_id>
			</p:element_type_param>
		</p:field>
		<p:field name="length">
			<p:element_type_param>
				<p:element_type_param_id>17</p:element_type_param_id>
				<p:param_type_id>2</p:param_type_id>
			</p:element_type_param>
		</p:field>
		<p:field name="veh_length_1">
			<p:element_type_param>
				<p:element_type_param_id>20</p:element_type_param_id>
				<p:param_type_id>2</p:param_type_id>
			</p:element_type_param>
		</p:field>
		<p:field name="veh_length_2">
			<p:element_type_param>
				<p:element_type_param_id>21</p:element_type_param_id>
				<p:param_type_id>2</p:param_type_id>
			</p:element_type_param>
		</p:field>
		<p:field name="veh_speed_1">
			<p:element_type_param>
				<p:element_type_param_id>40</p:element_type_param_id>
				<p:param_type_id>2</p:param_type_id>
			</p:element_type_param>
		</p:field>
		<p:field name="veh_speed_2">
			<p:element_type_param>
				<p:element_type_param_id>41</p:element_type_param_id>
				<p:param_type_id>2</p:param_type_id>
			</p:element_type_param>
		</p:field>
		<p:field name="veh_speed_3">
			<p:element_type_param>
				<p:element_type_param_id>42</p:element_type_param_id>
				<p:param_type_id>2</p:param_type_id>
			</p:element_type_param>
		</p:field>
	</p:fields>
</p:historical_element_parser_v1>